Product Name,Product Price
"Anua 7+ Rice Ceramide Hydrating Barrier Serum, 50ml","Rs. 7,600"
"BNB Organic Rice Sunscreen SPF60 Serum, 50ml","Rs. 1,850"
"BNB Organic Ceramide Rice Moisturizer, Paraben and Sulfate Free, Dermatologist-Tested, 120ml","Rs. 1,300"
"Muicin Dirt Away Rice Extract And Aloe Vera Gel SPA Body Scrub, 140g","Rs. 1,500"
"BNB Organic Source Rice Brightening Glow Kit, Face Wash+Scrub+Mask, Paraben and Sulfate Free, Dermatologist-Tested","Rs. 2,900"
"BNB Organic Source Brightening Rice Cleanser, Paraben and Sulfate Free, Dermatologist-Tested, 120ml",Rs. 985
"BNB Organic Source Brightening Rice Polisher, Paraben and Sulfate Free, Dermatologist-Tested, 120ml",Rs. 825
"Dadi Jan Chicken B.B.Q Flavor Rice Papad, 200g",Rs. 280
"BonaCibo Kitten Chicken With Anchovy & Rice Food, 1.5 KG","Rs. 3,800"
"BNB Organic Source Brightening Rice Scrub, Paraben and Sulfate Free, Dermatologist-Tested, 120ml",Rs. 825
"BNB Organic Rice Extract Serum, 30ml","Rs. 1,650"
Searle Prep-Up Baby Cereal Rice 175gm,Rs. 425
"BonaCibo Chicken With Anchovy & Rice Adult Cat Food, 2kg","Rs. 4,700"
BNB Rice Brightening Beauty Cream With Wrinkle Repair Retinol & Hyaluronic Acid,Rs. 750
"Anua Rice 70+Ceramide Glow Milky Toner, For Glass Skin, 250ml","Rs. 8,900"
"Muicin Rice Extract Reduces Acne & Oil Control Face Wash, 150g","Rs. 1,500"
"Muicin Rice Fairer & Flawless Skin Serum, For Fairer & Flawless Skin, 30ml","Rs. 2,000"
"Muicin Rice Extract Fair & Flawless Anti-Aging Skin Care Facial Kit, For All Skin Types","Rs. 3,500"
"Fauji Rice Flour, Premium Quality 100% Natural, 300g",Rs. 210
"Suree Rice Vermicelli, 400g",Rs. 665
"Suree Rice Stick 1mm, 400g",Rs. 665
"Suree Rice Stick 3mm, 400g",Rs. 665
"Suree Rice Stick 10mm, 400g",Rs. 665
"Suree Rice Stick 5mm, 400g",Rs. 665
Naheed Rice Kashmira 1 KG,Rs. 325
Naheed Rice Kashmira 5 KG,"Rs. 1,625"
Naheed Rice Kashmira 2.5 KG,Rs. 815
Fauji Rice Flakes 250gm,Rs. 615
Naheed Rice Mota Special 1 KG,Rs. 225
Naheed Rice Saila Special 2.5 KG,Rs. 880
Naheed Rice Saila Special 1 KG,Rs. 350
Naheed Rice Dhamaka Special 5 KG,"Rs. 2,000"
